Location Name,Category 1,Narrative 1,Category 2,Narrative 2,Category 3,Narrative 3,Category 4 ,Narrative 4,FIDS STATUS,Departure Status,Airline,Audiofile Name
Westeros,Transport,"Iron Fleet, Dothraki horse, and Targaryen dragon",Terrain,"Spanning the sandy dunes of Dorne, to the high peaks and rocky mountains of The Vale, to the marshy swamps in the Neck",Environment,Medieval,Atmosphere,The night is dark and full of terrors,On Time,Normal,Spellbound AIRLINES,
Wonderland,Distance from Austin,"About 4,000 miles",Transport,Falling through a rabbit-hole in slow-motion,Location,Possibly near the center of the earth,Atmosphere,Curiouser and curiouser,On Time,Normal,ArsLonga,
Yoknapatawpha County,Transport,Tull’s rattling mule-drawn wagon,Environment,Hot July wind and the smell of cedar trees,Terrain,A land of ruined fields and decayed mansions,Atmosphere,Apocryphal,On Time,Normal,AirLinguist,
Zembla,Location,Far to the north,Transport,An airplane in the evening sky,Weather,Very cold,Atmosphere,Beloved,On Time,Normal,Airudite,
Rhyonon,Location,The Tyon-omega system,Distance from Austin,Unfathomable light years away,Weather,"Hot and steaming, sandy and storm-scoured",Atmosphere,Noxious and unbreathable since the ruin,On Time,Normal,QUANTUM,
Pegāna,Location,Along the highway between the Worlds,Weather,"No rain nor regrets, only rose petal showers and a curtain of gleaming mist",Terrain,White peaks and a River of Silence,Transport,To the Middle of Time,On Time,Normal,PANACHE,